year,author,title,link,shl_has_link,shl_link
2000,"Kelly, Scott James",Far from consensual: The politics of British economic policy 1950-1955.,http://etheses.lse.ac.uk/2636/,True,http://catalogue.libraries.london.ac.uk/record=b1901993~S24
2000,"Kirchbach, Jorge Leal",The politics of privatization policies at local level in Mexico: The case of the water utilities in Aguascalientes.,http://etheses.lse.ac.uk/2495/,True,
2000,"Krahmann, Elke","Multilevel networks in British and German foreign policy, 1990-95.",http://etheses.lse.ac.uk/1561/,True,http://catalogue.libraries.london.ac.uk/record=b1911595~S24
2000,"Krueger, Jonathan P",Explaining regime content: The use of trade restrictive measures in multilateral environmental agreements.,http://etheses.lse.ac.uk/1606/,True,http://catalogue.libraries.london.ac.uk/record=b1867076~S24
2000,"Kubo, Katsuyuki",The determinants of executive compensation and its effect on company performance in Japan and the UK.,http://etheses.lse.ac.uk/47/,True,
2000,"Lacher, Hannes Peter","Historicising the global: Capitalism, territoriality and the international relations of modernity.",http://etheses.lse.ac.uk/1603/,True,http://catalogue.libraries.london.ac.uk/record=b1918286~S24
2000,"Liddiard, Mark","Museums into the millennium: The construction, reception and future of the past.",http://etheses.lse.ac.uk/2248/,True,http://catalogue.libraries.london.ac.uk/record=b1910091~S24
2000,"Lin, Angela",Initiating system innovation: A technological frames analysis of the origins of groupware projects.,http://etheses.lse.ac.uk/2875/,True,http://catalogue.libraries.london.ac.uk/record=b1916505~S24
2000,"Lodge, Martin C.E",On different tracks: Institutions and railway regulation in Britain and Germany.,http://etheses.lse.ac.uk/1607/,True,http://catalogue.libraries.london.ac.uk/record=b1867724~S24
2000,"Lorenz-Meyer, Dagmar Regine",The gendered politics of generational contracts. Changing discourses and practices of intergenerational commitments in West Germany.,http://etheses.lse.ac.uk/1613/,True,http://catalogue.libraries.london.ac.uk/record=b1870020~S24
2000,"Maria Fernandez de Larrinoa, Pedro",Carnival performance and folk aesthetics in a French Pyrenean Basque valley in the twentieth century: An anthropological study.,http://etheses.lse.ac.uk/2256/,True,http://catalogue.libraries.london.ac.uk/record=b1882767~S24
2000,"Matouschek, Niko Bernd Georg",Efficient organisation of economic institutions: Firms and contract enforcement agencies.,http://etheses.lse.ac.uk/1628/,True,http://catalogue.libraries.london.ac.uk/record=b1962114~S24
2000,"Matsukawa, Kyoko",European images of India before the rise of Orientalism in the late eighteenth century.,http://etheses.lse.ac.uk/1600/,True,
2000,"Matthews, Charles Kevin",The Irish boundary crisis and the reshaping of British politics: 1920-1925.,http://etheses.lse.ac.uk/1611/,True,
2000,"McGinnes, Simon",Conceptual modelling: A psychological perspective.,http://etheses.lse.ac.uk/2290/,True,http://catalogue.libraries.london.ac.uk/record=b2029778~S24
2000,"Moore, Sheila",The decriminalisation of suicide.,http://etheses.lse.ac.uk/1573/,True,
2000,"Morris, Martha","The role of the government in the import substitution of sailcloth, cordage and gunpowder in England 1558-1642.",http://etheses.lse.ac.uk/2792/,True,
2000,"New, Bill",Justifying state interventions: the case of paternalism.,http://etheses.lse.ac.uk/833/,True,http://catalogue.libraries.london.ac.uk/record=b1910068~S24
2000,"Newman, Kathleen Paula",Britain and the Soviet Union: The search for an interim agreement on West Berlin November 1958-May 1960.,http://etheses.lse.ac.uk/2633/,True,
2000,"O'Muircheartaigh, Colm Aongus",An investigation of response variance in sample surveys.,http://etheses.lse.ac.uk/1624/,True,
2000,"Panasyuk, Mykola B",The concept of social tolerance and social policy: A case study of crime and penal practices in the transitional period in Ukraine.,http://etheses.lse.ac.uk/1574/,True,
2000,"Pande, Rohini","The economics of public policy: Interventions in electoral representation, information transmission and investment choices.",http://etheses.lse.ac.uk/1514/,True,
2000,"Parales Quenza, Carlos Jose",Social representations of healthy eating: An empirical study in Colombia.,http://etheses.lse.ac.uk/2249/,True,
2000,"Peake, Edward","Tradition, Christianity, and the state in understandings of sickness and healing in South Nias, Indonesia.",http://etheses.lse.ac.uk/1558/,True,http://catalogue.libraries.london.ac.uk/record=b1907515~S24
2000,"Pegler, Lee J","Workers, unions and the 'politics of modernisation': Labour process change in the Brazilian white goods industry.",http://etheses.lse.ac.uk/2273/,True,
2000,"Pena, Cristina",Providing nursery education in poor neighbourhoods: Joint action by the community and the municipality in Montevideo.,http://etheses.lse.ac.uk/1569/,True,http://catalogue.libraries.london.ac.uk/record=b1879109~S24
2000,"Portides, Demetris Panayiotis",Representation models as devices for scientific theory applications vs. the semantic view of scientific theories: The case of models of the nuclear structure.,http://etheses.lse.ac.uk/1572/,True,http://catalogue.libraries.london.ac.uk/record=b1877112~S24
2000,"Rabin, M. Jeffrey",The idea of freedom in Michael Oakeshott and the contemporary liberal-communitarian debate.,http://etheses.lse.ac.uk/2873/,True,
2000,"Richter, Fabian Felix",Legitimate to whom? Comparing national perspectives on the legitimacy of the European Union.,http://etheses.lse.ac.uk/1614/,True,http://catalogue.libraries.london.ac.uk/record=b1913796~S24
2000,"Roller, Ruth Elisa",Catalonia and European integration: A regionalist strategy for nationalist objectives.,http://etheses.lse.ac.uk/1580/,True,http://catalogue.libraries.london.ac.uk/record=b1876344~S24
2000,"Rynhold, Daniel",Justifying one's practices: Two models of Jewish philosophy.,http://etheses.lse.ac.uk/1522/,True,http://catalogue.libraries.london.ac.uk/record=b1869573~S24
2000,"Santin Quiroz, Osvaldo Antonio","Political economy of Mexico's financial reform, 1988-1994.",http://etheses.lse.ac.uk/2874/,True,
2000,"Schellekens, Philip","Making monetary policy: Caution, conservatism and the public supply of liquidity.",http://etheses.lse.ac.uk/1583/,True,http://catalogue.libraries.london.ac.uk/record=b1876348~S24
2000,"Seckinelgin, M. Hakan",The Law of the Sea and the South Pacific: An ecological critique of the philosophical basis of international relations.,http://etheses.lse.ac.uk/2285/,True,
2000,"Sesil, James Charles",Decentralized decision-making and group incentives in British manufacturing establishments 1992-1995 and a British retail firm 1998: Recent econometric and case study evidence.,http://etheses.lse.ac.uk/1567/,True,http://catalogue.libraries.london.ac.uk/record=b1903604~S24
2000,"Sheriff, Mohamed Abdul",The value of information in organisations: A study of information use situations as contexts of value.,http://etheses.lse.ac.uk/1577/,True,
2000,"Snyder, J. Lauren",A critical theory of peace practice: Discourse ethics and facilitated conflict resolution.,http://etheses.lse.ac.uk/1575/,True,
2000,"Totoricaguena, Gloria Pilar","Comparing the Basque diaspora: Ethnonationalism, transnationalism and identity maintenance in Argentina, Australia, Belgium, Peru, the United States of America, and Uruguay.",http://etheses.lse.ac.uk/1592/,True,http://catalogue.libraries.london.ac.uk/record=b1897435~S24
2000,"Vandersluis, Sarah Blythe Owen","Ethics, free trade, and culture: The case of Canada-U.S. free trade in periodicals.",http://etheses.lse.ac.uk/2641/,True,http://catalogue.libraries.london.ac.uk/record=b1908971~S24
2000,"Verme, Paolo","Transition, recession and labour supply in Kazakhstan (1990-1996).",http://etheses.lse.ac.uk/1532/,True,http://catalogue.libraries.london.ac.uk/record=b1870423~S24
2000,"Visser, Gustav Etienne",Spatialities of social justice: Reflections on South African cities.,http://etheses.lse.ac.uk/1557/,True,http://catalogue.libraries.london.ac.uk/record=b1903848~S24
2000,"Walker, John Geoffrey",Labour market and rising living standards in 1950s western Europe: The case of the Netherlands.,http://etheses.lse.ac.uk/1601/,True,
2000,"Wolff, Stefan","Managing disputed territories, external minorities and the stability of conflict settlements: A comparative analysis of six cases.",http://etheses.lse.ac.uk/1515/,True,http://catalogue.libraries.london.ac.uk/record=b1868686~S24
2000,"Yahaya, Lateef Folarin",Information infrastructure development in Sub-Saharan Africa.,http://etheses.lse.ac.uk/2246/,True,http://catalogue.libraries.london.ac.uk/record=b1914518~S24
2000,"Yen, Yueh-ping",The sky rained with millet and the ghosts wailed in the night: An anthropological study of Chinese calligraphy.,http://etheses.lse.ac.uk/1527/,True,http://catalogue.libraries.london.ac.uk/record=b1871021~S24
